,Unnamed: 0,id,name
4800,4800,STLSTRINF.BO,Steel Strips Infrastructures Limited (BSE)
4801,4801,RAMAVISION.BO,Rama Vision Limited (BSE)
4802,4802,SAMTEX.BO,Samtex Fashions Limited (BSE)
4803,4803,KIDUJA.BO,Kiduja India Limited (BSE)
4804,4804,KKFIN.BO,K K Fincorp Limited (BSE)
4805,4805,PARSHWANA.BO,Parshwanath Corporation Limited (BSE)
4806,4806,ACIIN.BO,ACI Infocom Limited (BSE)
4807,4807,ELEFLOR.BO,Elegant Floriculture & Agrotech (India) Limited (BSE)
4808,4808,PARKERAC.BO,Parker Agrochem Exports Ltd. (BSE)
4809,4809,GOWRALE.BO,Gowra Leasing and Finance Limited (BSE)
4810,4810,KEYCORP.BO,Key Corp Limited (BSE)
4811,4811,SANTETX.BO,Sanrhea Technical Textiles Ltd. (BSE)
4812,4812,SHREEPAC.BO,Shree Pacetronix Limited (BSE)
4813,4813,CITYMAN.BO,Cityman Limited (BSE)
4814,4814,CSL.BO,Continental Securities Limited (BSE)
4815,4815,BKV.BO,BKV Industries Limited (BSE)
4816,4816,OMNIAX.BO,Omni Ax's Software Limited (BSE)
4817,4817,MPL.BO,MPL Plastics Limited (BSE)
4818,4818,STARLITE.BO,Starlite Components Limited (BSE)
4819,4819,CONTCHM.BO,Continental Chemicals Limited (BSE)
4820,4820,GLCL.BO,Globe Commercials Limited (BSE)
4821,4821,SEVENHILL.BO,Seven Hill Industries Limited (BSE)
4822,4822,PRATIKSH.BO,Pratiksha Chemicals Limited (BSE)
4823,4823,ISTRNETWK.BO,iStreet Network Limited (BSE)
4824,4824,BERVINL.BO,Bervin Investment and Leasing Limited (BSE)
4825,4825,SILVOAK.BO,Silver Oak (India) Limited (BSE)
4826,4826,UNIROYAL.BO,Uniroyal Industries Limited (BSE)
4827,4827,CHANDRIMA.BO,Chandrima Mercantiles Limited (BSE)
4828,4828,NUTECGLOB.BO,Nutech Global Limited (BSE)
4829,4829,NCCBLUE.BO,NCC Bluewater Products Limited (BSE)
4830,4830,CINDHO.BO,Cindrella Hotels Limited (BSE)
4831,4831,TATIAGLOB.BO,Tatia Global Vennture Limited (BSE)
4832,4832,INTSTOIL.BO,Inter State Oil Carrier Limited (BSE)
4833,4833,PICTUREHS.BO,Picturehouse Media Limited (BSE)
4834,4834,PANINDIAC.BO,Pan India Corporation Limited (BSE)
4835,4835,RELICTEC.BO,Relic Technologies Limited (BSE)
4836,4836,AVAILFC.BO,Available Finance Limited (BSE)
4837,4837,ICSL.BO,Integrated Capital Services Limited (BSE)
4838,4838,TRANSFD.BO,Transglobe Foods Limited (BSE)
4839,4839,DYNAMICP.BO,Dynamic Portfolio Management & Services Limited (BSE)
4840,4840,AMBARPIL.BO,Ambar Protein Industries Limited (BSE)
4841,4841,GBFL.BO,Goenka Business & Finance Limited (BSE)
4842,4842,SIKOZY.BO,Sikozy Realtors Limited (BSE)
4843,4843,IFINSER.BO,Interactive Financial Services Limited (BSE)
4844,4844,ESHAMEDIA.BO,Esha Media Research Limited (BSE)
4845,4845,JAIPAN.BO,Jaipan Industries Limited (BSE)
4846,4846,MYSTICELE.BO,Mystic Electronics Limited (BSE)
4847,4847,ALFL.BO,Abhinav Leasing and Finance Limited (BSE)
4848,4848,MAHACORP.BO,Maharashtra Corporation Limited (BSE)
4849,4849,OCTAVE.BO,Perfect Octave Media Projects Limited (BSE)
4850,4850,PRIYALT.BO,Priya Limited (BSE)
4851,4851,DECOMIC.BO,Deco-Mica Limited (BSE)
4852,4852,ADITYA.BO,Aditya Ispat Limited (BSE)
4853,4853,MTPL.BO,Marg Techno-Projects Limited (BSE)
4854,4854,HOWARHO.BO,Howard Hotels Limited (BSE)
4855,4855,MEGRISOFT.BO,Megri Soft Limited (BSE)
4856,4856,PREMSYN.BO,Premier Synthetics Limited (BSE)
4857,4857,JDORGOCHEM.BO,JD Orgochem Limited (BSE)
4858,4858,TRITON.BO,Triton Corp Limited (BSE)
4859,4859,LORDSHOTL.BO,Lords Ishwar Hotels Limited (BSE)
4860,4860,NDASEC.BO,NDA Securities Limited (BSE)
4861,4861,EPIC.BO,Epic Energy Limited (BSE)
4862,4862,BNRUDY.BO,BNR Udyog Limited (BSE)
4863,4863,JLL.BO,Jindal Leasefin Limited (BSE)
4864,4864,RAGHUTOB.BO,RTCL Limited (BSE)
4865,4865,PHOTOQUP.BO,Photoquip India Limited (BSE)
4866,4866,SEASONST.BO,Seasons Textiles Limited (BSE)
4867,4867,COMCL.BO,Comfort Commotrade Limited (BSE)
4868,4868,STEP2COR.BO,Step Two Corporation Limited (BSE)
4869,4869,ESARIND.BO,Esaar (India) Limited (BSE)
4870,4870,UNITEDINT.BO,United Interactive Limited (BSE)
4871,4871,GOLECHA.BO,Golechha Global Finance Limited (BSE)
4872,4872,STCORP.BO,S and T Corporation Limited (BSE)
4873,4873,MEHIF.BO,Mehta Integrated Finance Limited (BSE)
4874,4874,ESSARSEC.BO,Essar Securities Limited (BSE)
4875,4875,PNTKYOR.BO,Pentokey Organy (India) Limited (BSE)
4876,4876,FRANKLININD.BO,Franklin Industries Limited (BSE)
4877,4877,SEATV.BO,Sea TV Network Limited (BSE)
4878,4878,MAYUKH.BO,Mayukh Dealtrade Limited (BSE)
4879,4879,SOUTHERNIN.BO,Southern Infosys Limited (BSE)
4880,4880,VANDANA.BO,Vandana Knitwear Limited (BSE)
4881,4881,VINTRON.BO,Vintron Informatics Limited (BSE)
4882,4882,BHAGWOX.BO,Bhagawati Oxygen Limited (BSE)
4883,4883,WILLIMFI.BO,Williamson Financial Services Limited (BSE)
4884,4884,UNJHAFOR.BO,Unjha Formulations Limited (BSE)
4885,4885,BACPHAR.BO,Bacil Pharma Limited (BSE)
4886,4886,SEL.BO,Sanathnagar Enterprises Limited (BSE)
4887,4887,GSBFIN.BO,GSB Finance Limited (BSE)
4888,4888,DEVINE.BO,Devine Impex Limited (BSE)
4889,4889,MATHEWE.BO,Mathew Easow Research Securities Limited (BSE)
4890,4890,SANTOSHF.BO,Santosh Fine Fab Limited (BSE)
4891,4891,KACHCHH.BO,Kachchh Minerals Limited (BSE)
4892,4892,TRANSFRE.BO,Trans Freight Containers Limited (BSE)
4893,4893,INFORTEC.BO,Informed Technologies India Limited (BSE)
4894,4894,KZLFIN.BO,K Z Leasing and Finance Limited (BSE)
4895,4895,JINDCAP.BO,Jindal Capital Limited (BSE)
4896,4896,MILLENNIUM.BO,Millennium Online Solutions (India) Limited (BSE)
4897,4897,STRLGUA.BO,Sterling Guaranty & Finance Limited (BSE)
4898,4898,MIDEASTP.BO,Mid East Portfolio Management Limited (BSE)
4899,4899,SLSTLQ.BO,Sri Lakshmi Saraswathi Textiles (Arni) Limited (BSE)
4900,4900,MAHALXSE.BO,Mahalaxmi Seamless Limited (BSE)
4901,4901,KANDAGIRI.BO,Kandagiri Spinning Mills Limited (BSE)
4902,4902,ORTEL.NS,Ortel Communications Limited (NSE)
4903,4903,GANGOTRI.NS,Gangotri Textiles Limited (NSE)
4904,4904,BERLDRG.BO,Beryl Drugs Limited (BSE)
4905,4905,LONTE.BO,Longview Tea Company Limited (BSE)
4906,4906,ORGCOAT.BO,Organic Coatings Limited (BSE)
4907,4907,PFLINFOTC.BO,PFL Infotech Limited (BSE)
4908,4908,NEELKAN.BO,Neelkanth Rockminerals Limited (BSE)
4909,4909,INDRANIB.BO,Indrayani Biotech Limited (BSE)
4910,4910,FRUTION.BO,Fruition Venture Limited (BSE)
4911,4911,SYMBIOX.BO,Symbiox Investment & Trading Co Ltd (BSE)
4912,4912,PROMACT.BO,Promact Impex Limited (BSE)
4913,4913,FUTURSEC.BO,Futuristic Securities Limited (BSE)
4914,4914,OONE.BO,ObjectOne Information Systems Limited (BSE)
4915,4915,DHENUBUILD.BO,Dhenu Buildcon Infra Limited (BSE)
4916,4916,IYKOTHITE.BO,Iykot Hitech Toolroom Limited (BSE)
4917,4917,TAAZAINT.BO,Taaza International Limited (BSE)
4918,4918,MARGOFIN.BO,Margo Finance Limited (BSE)
4919,4919,IISL.BO,Ishaan Infrastructures and Shelters Limited (BSE)
4920,4920,ADCON.BO,Adcon Capital Services Limited (BSE)
4921,4921,NAGTECH.BO,Nagarjuna Agri-Tech Limited (BSE)
4922,4922,ALCHCORP.BO,Alchemist Corporation Limited (BSE)
4923,4923,HITTCO.BO,Hittco Tools Limited (BSE)
4924,4924,SITAENT.BO,Sita Enterprises Limited (BSE)
4925,4925,GRATEXI.BO,Gratex Industries Limited (BSE)
4926,4926,AFEL.BO,AF Enterprises Limited (BSE)
4927,4927,GOPAIST.BO,Gopal Iron & Steel Co. (Gujarat) Limited (BSE)
4928,4928,GANGOTRI.BO,Gangotri Textiles Limited (BSE)
4929,4929,SURFI.BO,Suryo Foods & Industries Limited (BSE)
4930,4930,RAMGOPOLY.BO,Ramgopal Polytex Limited (BSE)
4931,4931,KBSINDIA.BO,KBS India Limited (BSE)
4932,4932,CLFL.BO,Classic Leasing & Finance Limited (BSE)
4933,4933,INTRGLB.BO,Inter Globe Finance Limited (BSE)
4934,4934,ANNAINFRA.BO,Anna Infrastructures Limited (BSE)
4935,4935,ARISE.BO,Arihant's Securities Limited (BSE)
4936,4936,INDRENEW.BO,Ind Renewable Energy Limited (BSE)
4937,4937,CATVISION.BO,Catvision Limited (BSE)
4938,4938,CHEMOPH.BO,Chemo Pharma Laboratories Limited (BSE)
4939,4939,PHCAP.BO,P.H. Capital Limited (BSE)
4940,4940,INDRAIND.BO,Indra Industries Limited (BSE)
4941,4941,COLINZ.BO,Colinz Laboratories Limited (BSE)
4942,4942,VISIONCINE.BO,Vision Cinemas Limited (BSE)
4943,4943,GLITTEKG.BO,Glittek Granites Limited (BSE)
4944,4944,INDXTRA.BO,IEL Limited (BSE)
4945,4945,SBFL.BO,Shree Bhavya Fabrics Limited (BSE)
4946,4946,BRIDGESE.BO,Bridge Securities Limited (BSE)
4947,4947,MPCOSEMB.BO,Mipco Seamless Rings (Gujarat) Limited (BSE)
4948,4948,NCLRESE.BO,NCL Research & Financial Services Limited (BSE)
4949,4949,SUDAI.BO,Sudal Industries Limited (BSE)
4950,4950,NETLINK.BO,Netlink Solutions (India) Limited (BSE)
4951,4951,KMFBLDR.BO,KMF Builders & Developers Limited (BSE)
4952,4952,ODYCORP.BO,Odyssey Corporation Limited (BSE)
4953,4953,MINAXI.BO,Minaxi Textiles Limited (BSE)
4954,4954,STDBAT.BO,The Standard Batteries Limited (BSE)
4955,4955,SHVFL.BO,Shreevatsaa Finance and Leasing Limited (BSE)
4956,4956,WELCURE.BO,Welcure Drugs & Pharmaceuticals Limited (BSE)
4957,4957,CORPOCO.BO,Corporate Courier and Cargo Limited (BSE)
4958,4958,NOGMIND.BO,Neogem India Limited (BSE)
4959,4959,PMTELELIN.BO,P.M. Telelinnks Limited (BSE)
4960,4960,KINETRU.BO,Kinetic Trust Limited (BSE)
4961,4961,TRISHAKT.BO,Trishakti Electronics & Industries Limited (BSE)
4962,4962,ADIEXRE.BO,Adinath Exim Resources Limited (BSE)
4963,4963,GOLCA.BO,Golden Carpets Limited (BSE)
4964,4964,AJEL.BO,Ajel Limited (BSE)
4965,4965,FRASER.BO,Fraser and Company Limited (BSE)
4966,4966,LIBORDFIN.BO,Libord Finance Limited (BSE)
4967,4967,STRGRENWO.BO,Sterling Greenwoods Limited (BSE)
4968,4968,JPTSEC.BO,JPT Securities Limited (BSE)
4969,4969,PAEL.BO,PAE Limited (BSE)
4970,4970,GAGAN.BO,Gagan Gases Limited (BSE)
4971,4971,CONTICON.BO,Continental Controls Limited (BSE)
4972,4972,PANELEC.BO,Pan Electronics (India) Limited (BSE)
4973,4973,ASHRAM.BO,Ashram Online.com Limited (BSE)
4974,4974,RAJKSYN.BO,Rajkamal Synthetics Limited (BSE)
4975,4975,PADMALAYAT.BO,Padmalaya Telefilms Limited (BSE)
4976,4976,PASARI.BO,Pasari Spinning Mills Limited (BSE)
4977,4977,UNISHIRE.BO,Unishire Urban Infra Limited (BSE)
4978,4978,SUNRAJDI.BO,Sunraj Diamond Exports Limited (BSE)
4979,4979,BAMPSL.BO,Bampsl Securities Limited (BSE)
4980,4980,KCLINFRA.BO,KCL Infra Projects Limited (BSE)
4981,4981,NIHARINF.BO,Nihar Info Global Limited (BSE)
4982,4982,RLF.BO,RLF Limited (BSE)
4983,4983,DHARFIN.BO,Dharani Finance Limited (BSE)
4984,4984,AMFORG.BO,Amforge Industries Limited (BSE)
4985,4985,CAPRICORN.BO,Capricorn Systems Global Solutions Limited (BSE)
4986,4986,SIELFNS.BO,Siel Financial Services Limited (BSE)
4987,4987,EKAMLEA.BO,Ekam Leasing and Finance Co. Ltd. (BSE)
4988,4988,PEETISEC.BO,Peeti Securities Limited (BSE)
4989,4989,RAJVIR.BO,Rajvir Industries Limited (BSE)
4990,4990,RAJVIR.NS,Rajvir Industries Limited (NSE)
4991,4991,CRANEINFRA.BO,Crane Infrastructure Limited (BSE)
4992,4992,ARAVALIS.BO,Aravali Securities & Finance Limited (BSE)
4993,4993,CONTILI.BO,Contil India Limited (BSE)
4994,4994,ZDHJERK.BO,Dhanvantri Jeevan Rekha Limited (BSE)
4995,4995,CORNE.BO,Coral Newsprints Ltd (BSE)
4996,4996,SUPERTEX.BO,Supertex Industries Limited (BSE)
4997,4997,JAIHINDS.BO,Jaihind Synthetics Limited (BSE)
4998,4998,GITARENEW.BO,Gita Renewable Energy Limited (BSE)
4999,4999,PADAMCO.BO,Padam Cotton Yarns Limited (BSE)
5000,5000,INDAGIV.BO,Ind Agiv Commerce Limited (BSE)
5001,5001,BETXIND.BO,Betex India Limited (BSE)
5002,5002,RAJINFRA.BO,Rajeswari Infrastructure Limited (BSE)
5003,5003,SALEM.BO,Salem Erode Investments Limited (BSE)
5004,5004,SOVERDIA.BO,Sovereign Diamonds Limited (BSE)
5005,5005,VIKALPS.BO,Vikalp Securities Limited (BSE)
5006,5006,MULLER.BO,Muller & Phipps (India) Limited (BSE)
5007,5007,SPSL.BO,Shree Precoated Steels Limited (BSE)
5008,5008,KHOOBSURAT.BO,Khoobsurat Limited (BSE)
5009,5009,MEHTAHG.BO,Mehta Housing Finance Limited (BSE)
5010,5010,KIRANSY-B.BO,Kiran Syntex Limited (BSE)
5011,5011,CEENIK.BO,Ceenik Exports (India) Limited (BSE)
5012,5012,INCON.BO,Incon Engineers Limited (BSE)
5013,5013,KORE.BO,Kore Foods Limited (BSE)
5014,5014,RCL.BO,Radhagobind Commercial Limited (BSE)
5015,5015,KJMCFIN.BO,KJMC Financial Services Limited (BSE)
5016,5016,IBRIGST.BO,Indian Bright Steel Company Limited (BSE)
5017,5017,SYBLY.BO,Sybly Industries Limited (BSE)
5018,5018,ROYALIND.BO,Royal India Corporation Limited (BSE)
5019,5019,NYSSACORP.BO,Nyssa Corporation Limited (BSE)
5020,5020,SUPERBAK.BO,Super Bakers (India) Limited (BSE)
5021,5021,MPAGI.BO,M P Agro Industries Limited (BSE)
5022,5022,GARWAMAR.BO,Garware Marine Industries Limited (BSE)
5023,5023,REGTRUS.BO,Regency Trust Limited (BSE)
5024,5024,RAJGASES.BO,Rajasthan Gases Limited (BSE)
5025,5025,SPICEISL.BO,Spice Islands Apparels Limited (BSE)
5026,5026,SRMENERGY.BO,SRM Energy Limited (BSE)
5027,5027,RICHIRICH.BO,Richirich Inventures Limited (BSE)
5028,5028,JAUSPOL.BO,Jauss Polymers Limited (BSE)
5029,5029,KIRANPR.BO,Kiran Print-Pack Limited (BSE)
5030,5030,JAIMATAG.BO,Jai Mata Glass Limited (BSE)
5031,5031,PRIMIND.BO,Prime Industries Ltd. (BSE)
5032,5032,MAYURFL.BO,Mayur Floorings Limited (BSE)
5033,5033,TWINSTAR.BO,Twinstar Industries Limited (BSE)
5034,5034,APIL.BO,AVI Products India Limited (BSE)
5035,5035,ADVIKCA.BO,Advik Capital Limited (BSE)
5036,5036,PANKAJPO.BO,Pankaj Polymers Limited (BSE)
5037,5037,SHESHAINDS.BO,Sheshadri Industries Limited (BSE)
5038,5038,RICHAIND.BO,Richa Industries Limited (BSE)
5039,5039,ABIRAFN.BO,Abirami Financial Services (India) Limited (BSE)
5040,5040,AVIVA.BO,Aviva Industries Limited (BSE)
5041,5041,HEERAISP.BO,Heera Ispat Limited (BSE)
5042,5042,ANERI.BO,Aneri Fincap Limited (BSE)
5043,5043,CHENFERRO.BO,Chennai Ferrous Industries Limited (BSE)
5044,5044,SRECR.BO,Sreechem Resins Limited (BSE)
5045,5045,SHAQUAK.BO,52 Weeks Entertainment Limited (BSE)
5046,5046,DOLPHMED.BO,Dolphin Medical Services Limited (BSE)
5047,5047,JAYBHCR.BO,Jayabharat Credit Limited (BSE)
5048,5048,VBIND.BO,V. B. Industries Limited (BSE)
5049,5049,GLOBALCA.BO,Global Capital Markets Limited (BSE)
5050,5050,CARNATIN.BO,Carnation Industries Limited (BSE)
5051,5051,BAZELINTER.BO,Bazel International Limited (BSE)
5052,5052,DAULAT.BO,Daulat Securities Limited (BSE)
5053,5053,ASINPET.BO,Asian Petro Products and Exports Limited (BSE)
5054,5054,MINOLTAF.BO,Minolta Finance Limited (BSE)
5055,5055,VAXHS.BO,Vax Housing Finance Corporation Limited (BSE)
5056,5056,EXPLICITFIN.BO,Explicit Finance Limited (BSE)
5057,5057,ARCEEIN.BO,Arcee Industries Limited (BSE)
5058,5058,TPROJECT.BO,Thirani Projects Limited (BSE)
5059,5059,CITYONLINE.BO,City Online Services Limited (BSE)
5060,5060,RASSIREF.BO,Raasi Refractories Limited (BSE)
5061,5061,PANAFIC.BO,Panafic Industrials Limited (BSE)
5062,5062,VBDESAI.BO,V. B. Desai Financial Services Limited (BSE)
5063,5063,GOLDLINE.BO,Gold Line International Finvest Limited (BSE)
5064,5064,HARIAEXPO.BO,Haria Exports Limited (BSE)
5065,5065,CISTRO.BO,Cistro Telelink Limited (BSE)
5066,5066,4THGEN.BO,Fourth Generation Information Systems Limited (BSE)
5067,5067,ACEEDU.BO,ACE Edutrend Limited (BSE)
5068,5068,GUJCMDS.BO,Gujchem Distillers India Limited (BSE)
5069,5069,INNOCORP.BO,Innocorp Limited (BSE)
5070,5070,TTIENT.BO,TTI Enterprise Limited (BSE)
5071,5071,VANICOM.BO,Vani Commercials Limited (BSE)
5072,5072,UNITEDTE.BO,United Textiles Limited (BSE)
5073,5073,ASHISHPO.BO,Ashish Polyplast Limited (BSE)
5074,5074,JJFINCOR.BO,J.J. Finance Corporation Limited (BSE)
5075,5075,GMETCOAL.BO,Gujarat Metallic Coal & Coke Limited (BSE)
5076,5076,IBINFO.BO,IB Infotech Enterprises Limited (BSE)
5077,5077,GOLDCOINHF.BO,GoldCoin Health Foods Limited (BSE)
5078,5078,IDM.BO,International Data Management Limited (BSE)
5079,5079,NNTL.BO,N2N Technologies Limited (BSE)
5080,5080,HBLEAS.BO,HB Leasing and Finance Company Limited (BSE)
5081,5081,MAITRI.BO,Maitri Enterprises Limited (BSE)
5082,5082,OSWAYRN.BO,Oswal Yarns Limited (BSE)
5083,5083,ENTRINT.BO,Enterprise International Limited (BSE)
5084,5084,SUNGOLD.BO,Sungold Capital Limited (BSE)
5085,5085,KABRADG.BO,Kabra Drugs Limited (BSE)
5086,5086,LEADFIN.BO,Lead Financial Services Limited (BSE)
5087,5087,GRAVITY.BO,Gravity (India) Limited (BSE)
5088,5088,GKCONS.BO,G.K. Consultants Limited (BSE)
5089,5089,PANKAJPIYUS.BO,Pankaj Piyush Trade and Investment Limited (BSE)
5090,5090,UNIWORTH.BO,Uniworth Limited (BSE)
5091,5091,ABCGAS.BO,ABC Gas (International) Limited (BSE)
5092,5092,MIVENMACH.BO,Miven Machine Tools Limited (BSE)
5093,5093,LESHAIND.BO,Lesha Industries Limited (BSE)
5094,5094,VISAGAR.BO,Visagar Financial Services Limited (BSE)
5095,5095,JHACC.BO,Jhaveri Credits and Capital Limited (BSE)
5096,5096,VISIONCO.BO,Vision Corporation Limited (BSE)
5097,5097,SAFFRON.BO,Saffron Industries Limited (BSE)
5098,5098,SVAMSOF.BO,Svam Software Limited (BSE)
5099,5099,LOOKS.BO,Looks Health Services Limited (BSE)
5100,5100,FGP.BO,FGP Limited (BSE)
5101,5101,GSLSEC.BO,GSL Securities Limited (BSE)
5102,5102,QUEST.BO,Quest Softech (India) Limited (BSE)
5103,5103,DARJEELING.BO,Darjeeling Ropeway Company Limited (BSE)
5104,5104,CHMBBRW.BO,Chambal Breweries & Distilleries Limited (BSE)
5105,5105,SIDDHA.BO,Siddha Ventures Limited (BSE)
5106,5106,BISIL.BO,Bisil Plast Limited (BSE)
5107,5107,AGIOPAPER.BO,Agio Paper & Industries Limited (BSE)
5108,5108,INDOCITY.BO,Indo-City Infotech Limited (BSE)
5109,5109,GOLKONDA.BO,Golkonda Aluminium Extrusions Limited (BSE)
5110,5110,GUJINV.BO,Gujarat Investa Limited (BSE)
5111,5111,COMPUPN.BO,Computer Point Limited (BSE)
5112,5112,ATHARVENT.BO,Atharv Enterprises Limited (BSE)
5113,5113,GARWSYN.BO,Garware Synthetics Limited (BSE)
5114,5114,DELTA.BO,Delta Industrial Resources Limited (BSE)
5115,5115,SHAHFOOD.BO,Shah Foods Limited (BSE)
5116,5116,MAHANIN.BO,Mahan Industries Limited (BSE)
5117,5117,DHRUVCA.BO,Dhruva Capital Services Ltd. (BSE)
5118,5118,ANJANIFIN.BO,Anjani Finance Limited (BSE)
5119,5119,RLFL.BO,Ramchandra Leasing and Finance Limited (BSE)
5120,5120,KKPLASTICK.BO,Kkalpana Plastick Limited (BSE)
5121,5121,HITKITGLO.BO,Hit Kit Global Solutions Limited (BSE)
5122,5122,CCFCL.BO,Classic Global Finance and Capital Limited (BSE)
5123,5123,BRIJLEAS.BO,Brijlaxmi Leasing & Finance Limited (BSE)
5124,5124,SHEETAL.BO,Sheetal Diamonds Limited (BSE)
5125,5125,LWSKNIT.BO,LWS Knitwear Limited (BSE)
5126,5126,QUASAR.BO,Quasar India Limited (BSE)
5127,5127,YARNSYN.BO,Yarn Syndicate Limited (BSE)
5128,5128,MINFY.BO,Mahaveer Infoway Limited (BSE)
5129,5129,RAGHUNAT.BO,Raghunath International Limited (BSE)
5130,5130,MUKATPIP.BO,Mukat Pipes Limited (BSE)
5131,5131,ADINATH.BO,Adinath Textiles Limited (BSE)
5132,5132,KRISHNACAP.BO,Krishna Capital & Securities Limited (BSE)
5133,5133,SILVERO.BO,Silveroak Commercials Limited (BSE)
5134,5134,ZKHANDEN.BO,Khandelwal Extractions Limited (BSE)
5135,5135,CLIOINFO.BO,Clio Infotech Limited (BSE)
5136,5136,UNISTRMU.BO,Unistar Multimedia Limited (BSE)
5137,5137,MONGIPA.BO,Moongipa Capital Finance Limited (BSE)
5138,5138,TTIL.BO,Tirupati Tyres Limited (BSE)
5139,5139,ELANGO.BO,Elango Industries Limited (BSE)
5140,5140,POLYTEX.BO,Polytex India Limited (BSE)
5141,5141,DIAMANT.BO,Diamant Infrastructure Limited (BSE)
5142,5142,JTAPARIA.BO,J. Taparia Projects Limited (BSE)
5143,5143,KUSHIND.BO,Kush Industries Limited (BSE)
5144,5144,MARUTISE.BO,Maruti Securities Limited (BSE)
5145,5145,SAWABUSI.BO,Sawaca Business Machines Limited (BSE)
5146,5146,UNIVARTS.BO,Universal Arts Limited (BSE)
5147,5147,KAKTEX.BO,Kakatiya Textiles Limited (BSE)
5148,5148,KHYATI.BO,Khyati Multimedia Entertainment Limited (BSE)
5149,5149,MODWOOL.BO,Modella Woollens Limited (BSE)
5150,5150,EDSL.BO,eDynamics Solutions Limited (BSE)
5151,5151,COVIDH.BO,Covidh Technologies Limited (BSE)
5152,5152,ADVIKLA.BO,Advik Laboratories Limited (BSE)
5153,5153,SPECTRA.BO,Spectra Industries Limited (BSE)
5154,5154,AANANDALAK.BO,Aananda Lakshmi Spinning Mills Limited (BSE)
5155,5155,MINID.BO,Mini Diamonds (India) Limited (BSE)
5156,5156,USHAKIRA.BO,Ushakiran Finance Limited (BSE)
5157,5157,KOCL.BO,Kome-on Communication Limited (BSE)
5158,5158,BPCAP.BO,B. P. Capital Limited (BSE)
5159,5159,OMANSH.BO,Omansh Enterprises Limited (BSE)
5160,5160,BITL.BO,Bronze Infra-Tech Limited (BSE)
5161,5161,PRATIK.BO,Pratik Panels Limited (BSE)
5162,5162,BEEYU.BO,Beeyu Overseas Limited (BSE)
5163,5163,FISCHER.BO,Fischer Chemic Limited (BSE)
5164,5164,GEETANJ.BO,Geetanjali Credit and Capital Limited (BSE)
5165,5165,SCAGRO.BO,SC Agrotech Limited (BSE)
5166,5166,JAINCO.BO,Jainco Projects (India) Limited (BSE)
5167,5167,PRECISION.BO,Precision Containeurs Limited (BSE)
5168,5168,ASHAI.BO,Ashiana Agro Industries Limited (BSE)
5169,5169,TSPIRITUAL.BO,T. Spiritual World Limited (BSE)
5170,5170,SUPRATRE.BO,Supra Trends Limited (BSE)
5171,5171,PATIDAR.BO,Patidar Buildcon Limited (BSE)
5172,5172,BARONINF.BO,Baron Infotech Limited (BSE)
5173,5173,ABHIINFRA.BO,Abhishek Infraventures Limited (BSE)
5174,5174,NATHUEC.BO,Natura Hue Chem Limited (BSE)
5175,5175,SHIVA.BO,Shivansh Finserve Limited (BSE)
5176,5176,CONFINT.BO,Confidence Finance and Trading Limited (BSE)
5177,5177,KUBERJI.BO,Kuber Udyog Limited (BSE)
5178,5178,SIMPLXPAP.BO,Simplex Papers Limited (BSE)
5179,5179,EMAINDIA.BO,Ema India Limited (BSE)
5180,5180,CHITRTX.BO,Chitradurga Spintex Limited (BSE)
5181,5181,GTEIT.BO,G-Tech Info-Training Limited (BSE)
5182,5182,TATACOFFEE.NS,Tata Coffee Limited (NSE)
5183,5183,ARYAVAN.BO,ARYAVAN ENTERPRISE LIMITED (BSE)
5184,5184,SISL.BO,Share India Securities Limited (BSE)
5185,5185,GARODCH.BO,GARODIA CHEMICALS LTD. (BSE)
5186,5186,IBULHSGFIN-ZR.NS,Sec Re NCD 8.94% Sr.II (NSE)
5187,5187,IBULHSGFIN-AB.NS,Sec Re NCD 9.65% Sr.I (NSE)
5188,5188,GRCL-SM.NS,GAYATRI RUBBERS & (NSE)
5189,5189,SHRIRAMFIN-ZK.NS,SEC RED NCD SR.VIII (NSE)
5190,5190,LINAKS.BO,LINAKS MICROELECTRONICS LTD. (BSE)
5191,5191,ARCL.BO,ARCL Organics Ltd (BSE)
5192,5192,SREEJAYA.BO,Sree Jayalakshmi Autospin Limited (BSE)
5193,5193,UWCSL-SM.NS,ULTRA WIRING CONNE (NSE)
5194,5194,TIMESCAN-SM.NS,TIMESCAN LOGISTICS (NSE)
5195,5195,HIGHSTREE.BO,High Street Filatex Limited (BSE)
5196,5196,KAARYAFSL.BO,Kaarya Facilities and Services (BSE)
5197,5197,MUDUNURU.BO,Mudunuru Limited (BSE)
5198,5198,ABFL-N0.NS,Sec Re NCD 8% Sr I (NSE)
5199,5199,IBULHSGFIN-ZX.NS,Sec Re NCD Sr.VI (NSE)
5200,5200,IBULHSGFIN-AR.NS,Sec Re NCD 9.25% Sr II (NSE)
5201,5201,UNTTEMI.BO,UNITED LEASING & INDUSTRIES LT (BSE)
5202,5202,KGES.BO,Kuberan Global Edu Solutions L (BSE)
5203,5203,RONI.BO,Roni Households Limited (BSE)
5204,5204,DESTINY-SM.NS,DESTINY LOGISTICS (NSE)
5205,5205,OLYOI.BO,Olympic Oil Industries Limited (BSE)
5206,5206,NIEHSPJ.BO,Nippon India Mutual Fund (BSE)
5207,5207,JETINFRA.BO,Jet Infraventure Limited (BSE)
5208,5208,ZOMATO-BL.NS,Zomato Limited (NSE)
5209,5209,AKANKSHA-ST.NS,Akanksha Power N Infra L (NSE)
5210,5210,IPSL-SM.NS,INTEGRATED PERSONN (NSE)
5211,5211,SSTL.BO,Safa Systems & Technologies Li (BSE)
5212,5212,YSL.BO,The Yamuna Syndicate Ltd (BSE)
5213,5213,EASUN.BO,Easun Capital Markets Limited (BSE)
5214,5214,HARSHILAGR.BO,HARSHIL AGROTECH LIMITED (BSE)
5215,5215,MEHSECU.BO,MEHTA SECURITIES LTD. (BSE)
5216,5216,SINNAR.BO,Sinnar Bidi Udyog Limited (BSE)
5217,5217,IBULHSGFIN-AP.NS,Sec Re NCD 9.65% Sr I (NSE)
5218,5218,SHRIRAMFIN-Z2.NS,SEC RED NCD SR. VII (NSE)
5219,5219,FABINO.BO,Fabino Life Sciences Limited (BSE)
5220,5220,MLINDLTD.BO,M LAKHAMSI INDUSTRIES LIMITED (BSE)
5221,5221,INTEGFD.BO,Integrated Proteins Limited (BSE)
5222,5222,TANVI.BO,Tanvi Foods (India) Limited (BSE)
5223,5223,CMRSL-SM.NS,CYBER MEDIA RESEAR (NSE)
5224,5224,RCAN.BO,Rajeshwari Cans Limited (BSE)
5225,5225,TAVERNIER.BO,Tavernier Resources Limited (BSE)
5226,5226,SAILANI.BO,SAILANI TOURS N TRAVELS LIMITE (BSE)
5227,5227,MCLTD.BO,MUNOTH COMMUNICATION LIMITED (BSE)
5228,5228,AMARSEC.BO,Amarnath Securities Limited (BSE)
5229,5229,PARIN-SM.NS,PARIN FURNITURE LT (NSE)
5230,5230,SPRL-ST.NS,SP REFRACTORIES LI (NSE)
5231,5231,MINDPOOL-ST.NS,MINDPOOL TECHNOLOG (NSE)
5232,5232,CBPL.BO,Chandra Bhagat Pharma Limited (BSE)
5233,5233,ICICIB22.BO,ICICI Prudential Mutual Fund (BSE)
5234,5234,AGOL.BO,Ashapuri Gold Ornament Limited (BSE)
5235,5235,BAJEL.BO,Bajel Projects Limited (BSE)
5236,5236,URSUGAR.BO,UR SUGAR INDUSTRIES LIMITED (BSE)
5237,5237,KOTAKGOLD.BO,Kotak Gold Exchange Traded Scheme (BSE)
5238,5238,SEML.BO,Sunrise Efficient Marketing Li (BSE)
5239,5239,MIL.BO,Medico Intercontinental Limite (BSE)
5240,5240,BONLON.BO,BONLON INDUSTRIES LIMITED (BSE)
5241,5241,NAKSH.BO,Naksh Precious Metals Limited (BSE)
5242,5242,HFIL.BO,HIMALAYA FOOD INTERNATIONAL LI (BSE)
5243,5243,UPHOT.BO,U.P.HOTELS LTD. (BSE)
5244,5244,TOYAMSL.BO,TOYAM SPORTS LIMITED (BSE)
5245,5245,PRIMEFRESH.BO,PRIME FRESH LIMITED (BSE)
5246,5246,GALLOPENT.BO,Gallops Enterprise Limited (BSE)
5247,5247,LASTMILE.BO,LAST MILE ENTERPRISES LIMITED (BSE)
5248,5248,SURAJEST.NS,Suraj Estate Developers L (NSE)
5249,5249,DRONACHRYA.BO,Droneacharya Aerial Innovation (BSE)
5250,5250,SURAJEST.NS,Suraj Estate Developers L (NSE)
5251,5251,SBVCL.BO,Shri Balaji Valve Components L (BSE)
5252,5252,AIRTELPP-E1.NS,Bharti Rs. 1.25 ppd up (NSE)
5253,5253,VARDHMAN.BO,Vardhman Concrete Limited (BSE)
5254,5254,BBNPPGOLD.BO,BARODA BNP PARIBAS MUTUAL FUND (BSE)
5255,5255,MILEFUR.BO,Milestone Furniture Limited (BSE)
5256,5256,KAHAN.BO,Kahan Packaging Limited (BSE)
5257,5257,VIAZ-ST.NS,VIAZ TYRES LIMITED (NSE)
5258,5258,FRANKLIN.BO,Franklin Leasing and Finance Limited (BSE)
5259,5259,GUJINJEC.BO,GUJARAT INJECT (KERALA) LTD. (BSE)
5260,5260,SPS.BO,SPS Finquest Limited (BSE)
5261,5261,AXISPEGP.BO,Axis Mutual Fund (BSE)
5262,5262,INDERGR.BO,Indergiri Finance Limited (BSE)
5263,5263,SAROJA-SM.NS,SAROJA PHARMA INDU (NSE)
5264,5264,YCCL-SM.NS,YASONS CHEMEX CARE (NSE)
5265,5265,FOCE-SM.NS,FOCE INDIA LTD (NSE)
5266,5266,AARTISURF-P1.NS,Aarti Surfactants Limited (NSE)
5267,5267,ABCOTS-SM.NS,AB COTSPIN INDIA L (NSE)
5268,5268,MICROPRO-SM.NS,MICROPRO SOFTWARE (NSE)
5269,5269,MIHIKA.BO,Mihika Industries Limited (BSE)
5270,5270,INFOLLION-SM.NS,INFOLLION RESEARCH (NSE)
5271,5271,MUNCAPM.BO,Munoth Capital Market Limited (BSE)
5272,5272,WELTI.BO,Welterman International Limited (BSE)
5273,5273,NIEHSPL.BO,Nippon India Mutual Fund (BSE)
5274,5274,SANGANI-SM.NS,SANGANI HOSPITALS (NSE)
5275,5275,MAKS-ST.NS,MAKS ENERGY SOLUTI (NSE)
5276,5276,VASA-SM.NS,VASA RETAIL AND OV (NSE)
5277,5277,PROV-SM.NS,PROVENTUS AGROCOM (NSE)
